{
  "schema_version": 1,
  "id": "F000-example",
  "title": "Example retained finding",
  "summary": "One bounded invariant is under active source investigation.",
  "impact": "Without a current answer, later workers may repeat the same investigation or promote an unsupported transition.",
  "priority": "P2",
  "scope": {
    "programme": "example-programme",
    "target": "example-target",
    "workstream": "example-workstream",
    "parent_issue": 300
  },
  "state_updated_at": "1970-01-01T00:00:00Z",
  "invariant_id": "example-invariant",
  "canonical_finding": "findings/F000-example/finding.md",
  "phase": "research-active",
  "work_class": "upstream-fork-research",
  "review": {
    "disposition": "none",
    "exact_head": null,
    "reviewed_inputs": []
  },
  "evidence": [
    {
      "claim": "The current source path was inspected at the recorded revision.",
      "level": "source-read",
      "receipt": "findings/F000-example/evidence/19700101-worker-source-map.md",
      "limit": "No target execution has run."
    }
  ],
  "canonical_source": {
    "repository": "teamleaderleo/example",
    "branch": "fieldwork/example-invariant",
    "head": "0000000000000000000000000000000000000000"
  },
  "active_carrier": null,
  "writer_lease": {
    "state": "none",
    "holder": null,
    "repository": null,
    "resource_kind": "none",
    "resource": null,
    "generation_type": "none",
    "generation": null,
    "acquired_at": null,
    "renewed_at": null,
    "duration_seconds": null,
    "transition": 0,
    "previous_generation": null,
    "transfer_record": null
  },
  "freshness": {
    "base_head": "0000000000000000000000000000000000000000",
    "external_boundary": {
      "kind": "git-sha",
      "value": "0000000000000000000000000000000000000000",
      "source": "public example repository main"
    },
    "checked_at": "1970-01-01T00:00:00Z"
  },
  "authority": {
    "merge": {
      "state": "denied",
      "action": "merge",
      "target": {"kind": "none", "location": null, "operation_id": null, "data_class": "none"},
      "source": {"kind": "none", "record": null, "generation": null},
      "issued_at": null,
      "expires_at": null,
      "revocation_record": null
    },
    "release": {
      "state": "denied",
      "action": "release",
      "target": {"kind": "none", "location": null, "operation_id": null, "data_class": "none"},
      "source": {"kind": "none", "record": null, "generation": null},
      "issued_at": null,
      "expires_at": null,
      "revocation_record": null
    },
    "deploy": {
      "state": "denied",
      "action": "deploy",
      "target": {"kind": "none", "location": null, "operation_id": null, "data_class": "none"},
      "source": {"kind": "none", "record": null, "generation": null},
      "issued_at": null,
      "expires_at": null,
      "revocation_record": null
    },
    "upstream_contact": {
      "state": "denied",
      "action": "upstream_contact",
      "target": {"kind": "none", "location": null, "operation_id": null, "data_class": "none"},
      "source": {"kind": "none", "record": null, "generation": null},
      "issued_at": null,
      "expires_at": null,
      "revocation_record": null
    },
    "private_or_production_data": {
      "state": "denied",
      "action": "private_or_production_data",
      "target": {"kind": "none", "location": null, "operation_id": null, "data_class": "none"},
      "source": {"kind": "none", "record": null, "generation": null},
      "issued_at": null,
      "expires_at": null,
      "revocation_record": null
    },
    "material_spending": {
      "state": "denied",
      "action": "material_spending",
      "target": {"kind": "none", "location": null, "operation_id": null, "data_class": "none"},
      "source": {"kind": "none", "record": null, "generation": null},
      "issued_at": null,
      "expires_at": null,
      "revocation_record": null
    }
  },
  "blocker": null,
  "next_transition": "Run one bounded discriminating source or execution step.",
  "terminal_record": null
}
